{
  "schema_version": 1,
  "project": {
    "name": "Audit Financial Assistant",
    "lifecycle_stage": "RELEASE_READY",
    "product_types": [
      "consumer-web",
      "ai-assistant"
    ]
  },
  "users": [
    "authenticated"
  ],
  "markets": [
    "European Union"
  ],
  "platforms": [
    "web"
  ],
  "stack": {
    "languages": [
      "python"
    ],
    "frameworks": [],
    "services": []
  },
  "data": {
    "personal_data": true,
    "sensitive": [
      "financial",
      "location"
    ]
  },
  "ai": {
    "user_facing": true,
    "automated_decisions": true,
    "external_models": true
  },
  "risk": {
    "level": "critical"
  },
  "standards": {
    "version": "0.4.0"
  },
  "zeref": {
    "mode": "strict",
    "cost_ceiling": "bounded"
  },
  "unknowns": []
}
